smartctl 7.5 2025-04-30 r5714 [x86_64-linux-6.18.48-1-cachyos-lts] (local build)
Recorded 2026-09-07 21:38, device /dev/sda (ST1000LM035-1RK172, ZDE4QF5Y)

=== START OF READ SMART DATA SECTION ===
SMART overall-health self-assessment test result: PASSED


SMART Attributes Data Structure revision number: 10
Vendor Specific SMART Attributes with Thresholds:
ID# ATTRIBUTE_NAME          FLAG     VALUE WORST THRESH TYPE      UPDATED  WHEN_FAILED RAW_VALUE
  1 Raw_Read_Error_Rate     0x002f   076   064   006    Pre-fail  Always       -       36579166
  3 Spin_Up_Time            0x0023   099   099   000    Pre-fail  Always       -       0
  4 Start_Stop_Count        0x0032   073   073   000    Old_age   Always       -       28650
  5 Reallocated_Sector_Ct   0x0033   100   100   036    Pre-fail  Always       -       0
  7 Seek_Error_Rate         0x002f   087   060   045    Pre-fail  Always       -       454050396
  9 Power_On_Hours          0x0032   094   094   000    Old_age   Always       -       6057 (181 127 0)
 10 Spin_Retry_Count        0x0033   100   100   097    Pre-fail  Always       -       0
 12 Power_Cycle_Count       0x0032   097   097   000    Old_age   Always       -       3110
183 Runtime_Bad_Block       0x0032   100   100   000    Old_age   Always       -       0
184 End-to-End_Error        0x0033   100   100   097    Pre-fail  Always       -       0
187 Reported_Uncorrect      0x0032   100   100   000    Old_age   Always       -       0
188 Command_Timeout         0x0032   100   099   000    Old_age   Always       -       4295032835
189 High_Fly_Writes         0x003a   100   100   000    Old_age   Always       -       0
190 Airflow_Temperature_Cel 0x0022   060   051   040    Old_age   Always       -       40 (Min/Max 28/40)
191 G-Sense_Error_Rate      0x0032   100   100   000    Old_age   Always       -       272
192 Power-Off_Retract_Count 0x0022   100   100   000    Old_age   Always       -       58
193 Load_Cycle_Count        0x0032   059   059   000    Old_age   Always       -       83392
194 Temperature_Celsius     0x0022   040   049   000    Old_age   Always       -       40 (0 12 0 0 0)
196 Reallocated_Event_Count 0x0032   100   100   000    Old_age   Always       -       0
197 Current_Pending_Sector  0x0032   100   100   000    Old_age   Always       -       0
198 Offline_Uncorrectable   0x0030   100   100   000    Old_age   Offline      -       0
199 UDMA_CRC_Error_Count    0x0032   200   200   000    Old_age   Always       -       0
254 Free_Fall_Sensor        0x0032   100   100   000    Old_age   Always       -       0
